{
  "handoff_version": 1,
  "project": {
    "name": "foundry-paste-eater",
    "module_id": "foundry-paste-eater",
    "repo_path": ".",
    "foundry_target": "v13"
  },
  "conversation": {
    "intent": "Long-running coding, testing, support, release, and CI-hardening thread for Foundry Paste Eater.",
    "tags": {
      "domain": [
        "foundry",
        "clipboard",
        "canvas",
        "chat",
        "settings",
        "support",
        "storage",
        "testing"
      ],
      "phase": [
        "implementation",
        "verification",
        "release",
        "ci-fix",
        "post-release"
      ],
      "platform": [
        "foundry-v13",
        "macos",
        "finder",
        "chromium",
        "firefox",
        "github-actions"
      ],
      "product": [
        "selected-token-modes",
        "recommended-defaults",
        "readiness-panel",
        "uploaded-media-audit",
        "support-bundle",
        "gif-rasterization",
        "actor-link-default",
        "chat-upload-button"
      ],
      "future": [
        "owned-token-replacement-setting",
        "scene-drag-drop",
        "gif-to-webm-optional",
        "v14-validation"
      ]
    }
  },
  "user_preferences": [
    "Commit and push serially, never in parallel.",
    "Prefer strong verification and full release passes.",
    "Keep docs, tests, and runtime aligned.",
    "Prefer practical GM-facing UX and sensible defaults.",
    "Do not loosen compatibility claims without validation."
  ],
  "repo_state": {
    "branch": "main",
    "package_version": "1.3.0",
    "latest_tag": "1.3.0",
    "head_commit": "6fe72f0",
    "head_commit_subject": "Refresh handoff snapshot",
    "worktree_clean": true,
    "modified_files": [],
    "untracked_paths": [],
    "note": "Non-handoff repo state was clean immediately after commit 6fe72f0, and main matched origin/main when this refresh began. Handoff snapshot files under handoff/ remain excluded from repo-state parity checks."
  },
  "release_state": {
    "released_version": "1.3.0",
    "release_commit": "8ab2fc9",
    "release_title": "Foundry Paste Eater 1.3.0",
    "release_url": "https://github.com/sayhiben/foundry-paste-eater/releases/tag/1.3.0",
    "manifest_url": "https://github.com/sayhiben/foundry-paste-eater/releases/latest/download/module.json",
    "download_url": "https://github.com/sayhiben/foundry-paste-eater/releases/download/1.3.0/foundry-paste-eater_1.3.0.zip",
    "post_release_note": "The release tag does not include the CI-only follow-up commit f5ac610."
  },
  "validation_state": {
    "latest_local_release_pass": {
      "lint": "passed",
      "unit_tests": "passed",
      "typecheck": "passed",
      "build_runtime": "passed",
      "verify_bundle": "passed",
      "smoke": "92 passed, 1 skipped",
      "verify_release": "passed"
    },
    "latest_local_unit_after_ci_fix": {
      "tests_passed": 506,
      "coverage": {
        "statements": 99.86,
        "functions": 100.0,
        "branches": 85.28
      }
    },
    "latest_handoff_validation": {
      "script": "npm run handoff:validate",
      "status": "passed"
    },
    "ci": {
      "failing_release_run": 24111192623,
      "failing_reason": "Branch coverage was 84.99%, below the 85.00% threshold.",
      "fix_commit": "f5ac610",
      "latest_successful_run": 24111495040,
      "latest_status": "success"
    }
  },
  "decisions": [
    {
      "type": "decision",
      "summary": "Keep the module V13-only until V14 validation exists."
    },
    {
      "type": "decision",
      "summary": "Do not remove the manifest maximum compatibility version without a real V14 smoke pass."
    },
    {
      "type": "decision",
      "summary": "Canvas-bound GIFs are rasterized to PNG for reliable Foundry rendering; chat GIFs remain animated."
    },
    {
      "type": "decision",
      "summary": "New pasted tokens create backing Actors by default."
    },
    {
      "type": "decision",
      "summary": "New actor-backed pasted tokens default to actorLink true."
    },
    {
      "type": "decision",
      "summary": "Default empty-canvas media target is active layer."
    },
    {
      "type": "decision",
      "summary": "Canvas text paste defaults to scene notes."
    },
    {
      "type": "decision",
      "summary": "Selected token image paste defaults to Ask each time."
    },
    {
      "type": "decision",
      "summary": "Unless a test is explicitly validating logging settings or quiet-mode behavior, unit and smoke verification should run with the module's most verbose logging configuration enabled."
    }
  ],
  "implemented_changes": [
    "GM-only Readiness & Support panel",
    "GM-only Uploaded Media Audit panel",
    "Support bundle export and read-only support API",
    "Release hardening with typecheck, verify:bundle, and verify:release",
    "Runtime and test architecture refactor",
    "Smoke scene isolation",
    "Finder/native media paste hardening",
    "Chat focus restoration after chat paste",
    "Recommended-defaults and support/audit UI polish",
    "Actor-linked token creation by default for actor-backed pasted tokens",
    "Configurable pasted-token actor types and token-creation dialog",
    "Canonical handoff files, schema validation, and handoff protocol tooling",
    "Handoff validation decoupled from verify:release and converted to repo-relative non-handoff repo-state checks",
    "Handoff history append-only enforcement against tracked HEAD content and relaxed narrative-field minimum schema",
    "Handoff snapshots refreshed after staff-style code review so the next agent inherits the refined protocol and current dirty-state context",
    "AGENTS now treats maximum-verbosity unit and smoke verification as the default unless logging behavior itself is under test",
    "Local Playwright CLI debug artifacts are ignored through the .playwright-cli/ gitignore rule"
  ],
  "open_threads": [
    "Possible future setting: only allow token replacement for tokens owned by the user.",
    "Possible future feature: scene drag/drop from Finder or Explorer.",
    "Possible future experiment: optional GIF to WebM conversion for canvas uploads.",
    "Possible future validation: Foundry V14 compatibility pass."
  ],
  "files_to_read": [
    "AGENTS.md",
    "handoff/current.md",
    "handoff/schema.json",
    "README.md",
    "TESTING.md",
    "CHANGELOG.md",
    ".gitignore",
    "scripts/validate-handoff.js",
    "src/settings/schema.js",
    "src/canvas/create-strategies.js",
    "src/ui/chat.js",
    "src/ui/paste-events.js",
    "test/unit/ui-and-hooks.spec.js",
    "test/unit/support.spec.js",
    "test/playwright/config.spec.js",
    "test/playwright/smoke.canvas-media.spec.js"
  ],
  "recent_commands": [
    "git status --short",
    "git rev-parse --short HEAD",
    "git log --oneline --decorate -n 8",
    "git show --stat --summary HEAD -- handoff/current.md handoff/current.json handoff/history.ndjson AGENTS.md .gitignore",
    "npm run handoff:validate"
  ],
  "recent_turns": [
    {
      "speaker": "user",
      "summary": "Requested that AGENTS.md make maximum-verbosity logging the default posture for unit and smoke tests except when logging behavior itself is under test."
    },
    {
      "speaker": "assistant",
      "summary": "Confirmed the guidance belonged in AGENTS.md and recorded the verbose-logging testing expectation in prominent testing and maintainability sections."
    },
    {
      "speaker": "user",
      "summary": "Asked whether any current local-output paths should be added to .gitignore."
    },
    {
      "speaker": "assistant",
      "summary": "Reviewed the live worktree and identified .playwright-cli/ as the only obvious generated debug-output candidate to ignore."
    },
    {
      "speaker": "user",
      "summary": "Requested that .playwright-cli/ be added to .gitignore."
    },
    {
      "speaker": "assistant",
      "summary": "Added the .playwright-cli/ ignore rule."
    },
    {
      "speaker": "user",
      "summary": "Requested a final re-review of AGENTS.md, a handoff refresh, and then a commit and push."
    }
  ],
  "summary_lineage": [
    {
      "id": "thread-closeouts",
      "kind": "assistant-closeout-summaries",
      "note": "Earlier work was preserved informally through assistant close-out summaries after major implementation steps."
    },
    {
      "id": "carry-forward-summary",
      "kind": "system-progress-summary",
      "note": "A later system carry-forward summary captured the release-pass state and pending files before the final release work."
    },
    {
      "id": "handoff-v1",
      "kind": "canonical-compaction-root",
      "note": "This JSON + Markdown handoff is intended to become the canonical restart context for future agents."
    },
    {
      "id": "handoff-protocol-v1",
      "kind": "protocol-and-validation-layer",
      "note": "A schema, validator, npm script, verify-release gate, and AGENTS protocol were added to enforce future handoff quality."
    },
    {
      "id": "handoff-protocol-v2",
      "kind": "maintenance-safety-and-portability",
      "note": "Handoff validation was decoupled from verify:release, switched to repo-relative file references, changed to track non-handoff repo-state parity only, and now enforces append-only history updates once tracked while keeping narrative handoff fields recommended rather than schema-mandatory."
    },
    {
      "id": "handoff-refresh-v2",
      "kind": "refresh-and-maintainer-guidance",
      "note": "The tracked handoff snapshot was re-reviewed against the live clean main branch and updated to carry forward the current maintainer expectations around verbose diagnostics and ignored local Playwright CLI artifacts."
    }
  ],
  "compaction_protocol": {
    "compact_at_fraction": 0.7,
    "recent_turn_budget_fraction": 0.2,
    "summary_budget_fraction": 0.1,
    "headroom_fraction": 0.15,
    "rules": [